No.     Time           Source                Destination           Protocol Length Info
     69 2.496398       192.168.69.230        192.168.69.218        TCP      60     8235 → 59566 [ACK] Seq=1 Ack=1 Win=2832 Len=0

Frame 69: 60 bytes on wire (480 bits), 60 bytes captured (480 bits) on interface \Device\NPF_{150B9C73-9A6A-45E3-9512-836F6787EDE2}, id 0
Ethernet II, Src: JinanUSRIOTT_af:87:38 (d4:ad:20:af:87:38), Dst: MicroStarINT_f4:40:30 (4c:cc:6a:f4:40:30)
Internet Protocol Version 4, Src: 192.168.69.230, Dst: 192.168.69.218
Transmission Control Protocol, Src Port: 8235, Dst Port: 59566, Seq: 1, Ack: 1, Len: 0

No.     Time           Source                Destination           Protocol Length Info
     70 2.496689       192.168.69.218        192.168.69.230        TCP      54     [TCP ACKed unseen segment] 59566 → 8235 [ACK] Seq=1 Ack=2 Win=64090 Len=0

Frame 70: 54 bytes on wire (432 bits), 54 bytes captured (432 bits) on interface \Device\NPF_{150B9C73-9A6A-45E3-9512-836F6787EDE2}, id 0
Ethernet II, Src: MicroStarINT_f4:40:30 (4c:cc:6a:f4:40:30), Dst: JinanUSRIOTT_af:87:38 (d4:ad:20:af:87:38)
Internet Protocol Version 4, Src: 192.168.69.218, Dst: 192.168.69.230
Transmission Control Protocol, Src Port: 59566, Dst Port: 8235, Seq: 1, Ack: 2, Len: 0

No.     Time           Source                Destination           Protocol Length Info
     78 3.228313       192.168.69.218        192.168.69.230        TCP      62     59566 → 8235 [PSH, ACK] Seq=1 Ack=2 Win=64090 Len=8

Frame 78: 62 bytes on wire (496 bits), 62 bytes captured (496 bits) on interface \Device\NPF_{150B9C73-9A6A-45E3-9512-836F6787EDE2}, id 0
Ethernet II, Src: MicroStarINT_f4:40:30 (4c:cc:6a:f4:40:30), Dst: JinanUSRIOTT_af:87:38 (d4:ad:20:af:87:38)
Internet Protocol Version 4, Src: 192.168.69.218, Dst: 192.168.69.230
Transmission Control Protocol, Src Port: 59566, Dst Port: 8235, Seq: 1, Ack: 2, Len: 8
Data (8 bytes)

0000  d6 03 00 00 00 01 96 2d                           .......-
    Data: d60300000001962d
    [Length: 8]

No.     Time           Source                Destination           Protocol Length Info
     79 3.229357       192.168.69.230        192.168.69.218        TCP      60     [TCP Previous segment not captured] 8235 → 59566 [ACK] Seq=2 Ack=9 Win=2824 Len=0

Frame 79: 60 bytes on wire (480 bits), 60 bytes captured (480 bits) on interface \Device\NPF_{150B9C73-9A6A-45E3-9512-836F6787EDE2}, id 0
Ethernet II, Src: JinanUSRIOTT_af:87:38 (d4:ad:20:af:87:38), Dst: MicroStarINT_f4:40:30 (4c:cc:6a:f4:40:30)
Internet Protocol Version 4, Src: 192.168.69.230, Dst: 192.168.69.218
Transmission Control Protocol, Src Port: 8235, Dst Port: 59566, Seq: 2, Ack: 9, Len: 0

No.     Time           Source                Destination           Protocol Length Info
    108 5.402757       192.168.69.218        192.168.69.230        TCP      62     59566 → 8235 [PSH, ACK] Seq=9 Ack=2 Win=64090 Len=8

Frame 108: 62 bytes on wire (496 bits), 62 bytes captured (496 bits) on interface \Device\NPF_{150B9C73-9A6A-45E3-9512-836F6787EDE2}, id 0
Ethernet II, Src: MicroStarINT_f4:40:30 (4c:cc:6a:f4:40:30), Dst: JinanUSRIOTT_af:87:38 (d4:ad:20:af:87:38)
Internet Protocol Version 4, Src: 192.168.69.218, Dst: 192.168.69.230
Transmission Control Protocol, Src Port: 59566, Dst Port: 8235, Seq: 9, Ack: 2, Len: 8
Data (8 bytes)

0000  d7 03 00 00 00 01 97 fc                           ........
    Data: d7030000000197fc
    [Length: 8]

No.     Time           Source                Destination           Protocol Length Info
    109 5.403160       192.168.69.230        192.168.69.218        TCP      60     8235 → 59566 [ACK] Seq=2 Ack=17 Win=2816 Len=0

Frame 109: 60 bytes on wire (480 bits), 60 bytes captured (480 bits) on interface \Device\NPF_{150B9C73-9A6A-45E3-9512-836F6787EDE2}, id 0
Ethernet II, Src: JinanUSRIOTT_af:87:38 (d4:ad:20:af:87:38), Dst: MicroStarINT_f4:40:30 (4c:cc:6a:f4:40:30)
Internet Protocol Version 4, Src: 192.168.69.230, Dst: 192.168.69.218
Transmission Control Protocol, Src Port: 8235, Dst Port: 59566, Seq: 2, Ack: 17, Len: 0

No.     Time           Source                Destination           Protocol Length Info
    149 7.592074       192.168.69.218        192.168.69.230        TCP      62     59566 → 8235 [PSH, ACK] Seq=17 Ack=2 Win=64090 Len=8

Frame 149: 62 bytes on wire (496 bits), 62 bytes captured (496 bits) on interface \Device\NPF_{150B9C73-9A6A-45E3-9512-836F6787EDE2}, id 0
Ethernet II, Src: MicroStarINT_f4:40:30 (4c:cc:6a:f4:40:30), Dst: JinanUSRIOTT_af:87:38 (d4:ad:20:af:87:38)
Internet Protocol Version 4, Src: 192.168.69.218, Dst: 192.168.69.230
Transmission Control Protocol, Src Port: 59566, Dst Port: 8235, Seq: 17, Ack: 2, Len: 8
Data (8 bytes)

0000  d8 03 00 00 00 01 97 03                           ........
    Data: d803000000019703
    [Length: 8]

No.     Time           Source                Destination           Protocol Length Info
    150 7.592948       192.168.69.230        192.168.69.218        TCP      60     8235 → 59566 [ACK] Seq=2 Ack=25 Win=2808 Len=0

Frame 150: 60 bytes on wire (480 bits), 60 bytes captured (480 bits) on interface \Device\NPF_{150B9C73-9A6A-45E3-9512-836F6787EDE2}, id 0
Ethernet II, Src: JinanUSRIOTT_af:87:38 (d4:ad:20:af:87:38), Dst: MicroStarINT_f4:40:30 (4c:cc:6a:f4:40:30)
Internet Protocol Version 4, Src: 192.168.69.230, Dst: 192.168.69.218
Transmission Control Protocol, Src Port: 8235, Dst Port: 59566, Seq: 2, Ack: 25, Len: 0

No.     Time           Source                Destination           Protocol Length Info
    185 9.789399       192.168.69.218        192.168.69.230        TCP      62     59566 → 8235 [PSH, ACK] Seq=25 Ack=2 Win=64090 Len=8

Frame 185: 62 bytes on wire (496 bits), 62 bytes captured (496 bits) on interface \Device\NPF_{150B9C73-9A6A-45E3-9512-836F6787EDE2}, id 0
Ethernet II, Src: MicroStarINT_f4:40:30 (4c:cc:6a:f4:40:30), Dst: JinanUSRIOTT_af:87:38 (d4:ad:20:af:87:38)
Internet Protocol Version 4, Src: 192.168.69.218, Dst: 192.168.69.230
Transmission Control Protocol, Src Port: 59566, Dst Port: 8235, Seq: 25, Ack: 2, Len: 8
Data (8 bytes)

0000  d9 03 00 00 00 01 96 d2                           ........
    Data: d9030000000196d2
    [Length: 8]

No.     Time           Source                Destination           Protocol Length Info
    186 9.789751       192.168.69.230        192.168.69.218        TCP      60     8235 → 59566 [ACK] Seq=2 Ack=33 Win=2800 Len=0

Frame 186: 60 bytes on wire (480 bits), 60 bytes captured (480 bits) on interface \Device\NPF_{150B9C73-9A6A-45E3-9512-836F6787EDE2}, id 0
Ethernet II, Src: JinanUSRIOTT_af:87:38 (d4:ad:20:af:87:38), Dst: MicroStarINT_f4:40:30 (4c:cc:6a:f4:40:30)
Internet Protocol Version 4, Src: 192.168.69.230, Dst: 192.168.69.218
Transmission Control Protocol, Src Port: 8235, Dst Port: 59566, Seq: 2, Ack: 33, Len: 0

No.     Time           Source                Destination           Protocol Length Info
    218 11.980584      192.168.69.218        192.168.69.230        TCP      62     59566 → 8235 [PSH, ACK] Seq=33 Ack=2 Win=64090 Len=8

Frame 218: 62 bytes on wire (496 bits), 62 bytes captured (496 bits) on interface \Device\NPF_{150B9C73-9A6A-45E3-9512-836F6787EDE2}, id 0
Ethernet II, Src: MicroStarINT_f4:40:30 (4c:cc:6a:f4:40:30), Dst: JinanUSRIOTT_af:87:38 (d4:ad:20:af:87:38)
Internet Protocol Version 4, Src: 192.168.69.218, Dst: 192.168.69.230
Transmission Control Protocol, Src Port: 59566, Dst Port: 8235, Seq: 33, Ack: 2, Len: 8
Data (8 bytes)

0000  da 03 00 00 00 01 96 e1                           ........
    Data: da030000000196e1
    [Length: 8]

No.     Time           Source                Destination           Protocol Length Info
    219 11.981549      192.168.69.230        192.168.69.218        TCP      60     8235 → 59566 [ACK] Seq=2 Ack=41 Win=2792 Len=0

Frame 219: 60 bytes on wire (480 bits), 60 bytes captured (480 bits) on interface \Device\NPF_{150B9C73-9A6A-45E3-9512-836F6787EDE2}, id 0
Ethernet II, Src: JinanUSRIOTT_af:87:38 (d4:ad:20:af:87:38), Dst: MicroStarINT_f4:40:30 (4c:cc:6a:f4:40:30)
Internet Protocol Version 4, Src: 192.168.69.230, Dst: 192.168.69.218
Transmission Control Protocol, Src Port: 8235, Dst Port: 59566, Seq: 2, Ack: 41, Len: 0

No.     Time           Source                Destination           Protocol Length Info
    253 14.177153      192.168.69.218        192.168.69.230        TCP      62     59566 → 8235 [PSH, ACK] Seq=41 Ack=2 Win=64090 Len=8

Frame 253: 62 bytes on wire (496 bits), 62 bytes captured (496 bits) on interface \Device\NPF_{150B9C73-9A6A-45E3-9512-836F6787EDE2}, id 0
Ethernet II, Src: MicroStarINT_f4:40:30 (4c:cc:6a:f4:40:30), Dst: JinanUSRIOTT_af:87:38 (d4:ad:20:af:87:38)
Internet Protocol Version 4, Src: 192.168.69.218, Dst: 192.168.69.230
Transmission Control Protocol, Src Port: 59566, Dst Port: 8235, Seq: 41, Ack: 2, Len: 8
Data (8 bytes)

0000  db 03 00 00 00 01 97 30                           .......0
    Data: db03000000019730
    [Length: 8]

No.     Time           Source                Destination           Protocol Length Info
    254 14.177340      192.168.69.230        192.168.69.218        TCP      60     8235 → 59566 [ACK] Seq=2 Ack=49 Win=2784 Len=0

Frame 254: 60 bytes on wire (480 bits), 60 bytes captured (480 bits) on interface \Device\NPF_{150B9C73-9A6A-45E3-9512-836F6787EDE2}, id 0
Ethernet II, Src: JinanUSRIOTT_af:87:38 (d4:ad:20:af:87:38), Dst: MicroStarINT_f4:40:30 (4c:cc:6a:f4:40:30)
Internet Protocol Version 4, Src: 192.168.69.230, Dst: 192.168.69.218
Transmission Control Protocol, Src Port: 8235, Dst Port: 59566, Seq: 2, Ack: 49, Len: 0

No.     Time           Source                Destination           Protocol Length Info
    280 16.370467      192.168.69.218        192.168.69.230        TCP      62     59566 → 8235 [PSH, ACK] Seq=49 Ack=2 Win=64090 Len=8

Frame 280: 62 bytes on wire (496 bits), 62 bytes captured (496 bits) on interface \Device\NPF_{150B9C73-9A6A-45E3-9512-836F6787EDE2}, id 0
Ethernet II, Src: MicroStarINT_f4:40:30 (4c:cc:6a:f4:40:30), Dst: JinanUSRIOTT_af:87:38 (d4:ad:20:af:87:38)
Internet Protocol Version 4, Src: 192.168.69.218, Dst: 192.168.69.230
Transmission Control Protocol, Src Port: 59566, Dst Port: 8235, Seq: 49, Ack: 2, Len: 8
Data (8 bytes)

0000  dc 03 00 00 00 01 96 87                           ........
    Data: dc03000000019687
    [Length: 8]

No.     Time           Source                Destination           Protocol Length Info
    281 16.371147      192.168.69.230        192.168.69.218        TCP      60     8235 → 59566 [ACK] Seq=2 Ack=57 Win=2776 Len=0

Frame 281: 60 bytes on wire (480 bits), 60 bytes captured (480 bits) on interface \Device\NPF_{150B9C73-9A6A-45E3-9512-836F6787EDE2}, id 0
Ethernet II, Src: JinanUSRIOTT_af:87:38 (d4:ad:20:af:87:38), Dst: MicroStarINT_f4:40:30 (4c:cc:6a:f4:40:30)
Internet Protocol Version 4, Src: 192.168.69.230, Dst: 192.168.69.218
Transmission Control Protocol, Src Port: 8235, Dst Port: 59566, Seq: 2, Ack: 57, Len: 0

No.     Time           Source                Destination           Protocol Length Info
    321 18.563045      192.168.69.218        192.168.69.230        TCP      62     59566 → 8235 [PSH, ACK] Seq=57 Ack=2 Win=64090 Len=8

Frame 321: 62 bytes on wire (496 bits), 62 bytes captured (496 bits) on interface \Device\NPF_{150B9C73-9A6A-45E3-9512-836F6787EDE2}, id 0
Ethernet II, Src: MicroStarINT_f4:40:30 (4c:cc:6a:f4:40:30), Dst: JinanUSRIOTT_af:87:38 (d4:ad:20:af:87:38)
Internet Protocol Version 4, Src: 192.168.69.218, Dst: 192.168.69.230
Transmission Control Protocol, Src Port: 59566, Dst Port: 8235, Seq: 57, Ack: 2, Len: 8
Data (8 bytes)

0000  dd 03 00 00 00 01 97 56                           .......V
    Data: dd03000000019756
    [Length: 8]

No.     Time           Source                Destination           Protocol Length Info
    322 18.563937      192.168.69.230        192.168.69.218        TCP      60     8235 → 59566 [ACK] Seq=2 Ack=65 Win=2768 Len=0

Frame 322: 60 bytes on wire (480 bits), 60 bytes captured (480 bits) on interface \Device\NPF_{150B9C73-9A6A-45E3-9512-836F6787EDE2}, id 0
Ethernet II, Src: JinanUSRIOTT_af:87:38 (d4:ad:20:af:87:38), Dst: MicroStarINT_f4:40:30 (4c:cc:6a:f4:40:30)
Internet Protocol Version 4, Src: 192.168.69.230, Dst: 192.168.69.218
Transmission Control Protocol, Src Port: 8235, Dst Port: 59566, Seq: 2, Ack: 65, Len: 0

No.     Time           Source                Destination           Protocol Length Info
    357 20.753643      192.168.69.218        192.168.69.230        TCP      62     59566 → 8235 [PSH, ACK] Seq=65 Ack=2 Win=64090 Len=8

Frame 357: 62 bytes on wire (496 bits), 62 bytes captured (496 bits) on interface \Device\NPF_{150B9C73-9A6A-45E3-9512-836F6787EDE2}, id 0
Ethernet II, Src: MicroStarINT_f4:40:30 (4c:cc:6a:f4:40:30), Dst: JinanUSRIOTT_af:87:38 (d4:ad:20:af:87:38)
Internet Protocol Version 4, Src: 192.168.69.218, Dst: 192.168.69.230
Transmission Control Protocol, Src Port: 59566, Dst Port: 8235, Seq: 65, Ack: 2, Len: 8
Data (8 bytes)

0000  e0 03 00 00 00 01 93 bb                           ........
    Data: e0030000000193bb
    [Length: 8]

No.     Time           Source                Destination           Protocol Length Info
    358 20.754753      192.168.69.230        192.168.69.218        TCP      60     8235 → 59566 [ACK] Seq=2 Ack=73 Win=2760 Len=0

Frame 358: 60 bytes on wire (480 bits), 60 bytes captured (480 bits) on interface \Device\NPF_{150B9C73-9A6A-45E3-9512-836F6787EDE2}, id 0
Ethernet II, Src: JinanUSRIOTT_af:87:38 (d4:ad:20:af:87:38), Dst: MicroStarINT_f4:40:30 (4c:cc:6a:f4:40:30)
Internet Protocol Version 4, Src: 192.168.69.230, Dst: 192.168.69.218
Transmission Control Protocol, Src Port: 8235, Dst Port: 59566, Seq: 2, Ack: 73, Len: 0

No.     Time           Source                Destination           Protocol Length Info
    401 22.948010      192.168.69.218        192.168.69.230        TCP      62     59566 → 8235 [PSH, ACK] Seq=73 Ack=2 Win=64090 Len=8

Frame 401: 62 bytes on wire (496 bits), 62 bytes captured (496 bits) on interface \Device\NPF_{150B9C73-9A6A-45E3-9512-836F6787EDE2}, id 0
Ethernet II, Src: MicroStarINT_f4:40:30 (4c:cc:6a:f4:40:30), Dst: JinanUSRIOTT_af:87:38 (d4:ad:20:af:87:38)
Internet Protocol Version 4, Src: 192.168.69.218, Dst: 192.168.69.230
Transmission Control Protocol, Src Port: 59566, Dst Port: 8235, Seq: 73, Ack: 2, Len: 8
Data (8 bytes)

0000  e1 03 00 00 00 01 92 6a                           .......j
    Data: e10300000001926a
    [Length: 8]

No.     Time           Source                Destination           Protocol Length Info
    402 22.948541      192.168.69.230        192.168.69.218        TCP      60     8235 → 59566 [ACK] Seq=2 Ack=81 Win=2752 Len=0

Frame 402: 60 bytes on wire (480 bits), 60 bytes captured (480 bits) on interface \Device\NPF_{150B9C73-9A6A-45E3-9512-836F6787EDE2}, id 0
Ethernet II, Src: JinanUSRIOTT_af:87:38 (d4:ad:20:af:87:38), Dst: MicroStarINT_f4:40:30 (4c:cc:6a:f4:40:30)
Internet Protocol Version 4, Src: 192.168.69.230, Dst: 192.168.69.218
Transmission Control Protocol, Src Port: 8235, Dst Port: 59566, Seq: 2, Ack: 81, Len: 0

No.     Time           Source                Destination           Protocol Length Info
    471 25.137492      192.168.69.218        192.168.69.230        TCP      62     59566 → 8235 [PSH, ACK] Seq=81 Ack=2 Win=64090 Len=8

Frame 471: 62 bytes on wire (496 bits), 62 bytes captured (496 bits) on interface \Device\NPF_{150B9C73-9A6A-45E3-9512-836F6787EDE2}, id 0
Ethernet II, Src: MicroStarINT_f4:40:30 (4c:cc:6a:f4:40:30), Dst: JinanUSRIOTT_af:87:38 (d4:ad:20:af:87:38)
Internet Protocol Version 4, Src: 192.168.69.218, Dst: 192.168.69.230
Transmission Control Protocol, Src Port: 59566, Dst Port: 8235, Seq: 81, Ack: 2, Len: 8
Data (8 bytes)

0000  e2 03 00 00 00 01 92 59                           .......Y
    Data: e203000000019259
    [Length: 8]

No.     Time           Source                Destination           Protocol Length Info
    472 25.138345      192.168.69.230        192.168.69.218        TCP      60     8235 → 59566 [ACK] Seq=2 Ack=89 Win=2744 Len=0

Frame 472: 60 bytes on wire (480 bits), 60 bytes captured (480 bits) on interface \Device\NPF_{150B9C73-9A6A-45E3-9512-836F6787EDE2}, id 0
Ethernet II, Src: JinanUSRIOTT_af:87:38 (d4:ad:20:af:87:38), Dst: MicroStarINT_f4:40:30 (4c:cc:6a:f4:40:30)
Internet Protocol Version 4, Src: 192.168.69.230, Dst: 192.168.69.218
Transmission Control Protocol, Src Port: 8235, Dst Port: 59566, Seq: 2, Ack: 89, Len: 0

No.     Time           Source                Destination           Protocol Length Info
    511 27.336619      192.168.69.218        192.168.69.230        TCP      62     59566 → 8235 [PSH, ACK] Seq=89 Ack=2 Win=64090 Len=8

Frame 511: 62 bytes on wire (496 bits), 62 bytes captured (496 bits) on interface \Device\NPF_{150B9C73-9A6A-45E3-9512-836F6787EDE2}, id 0
Ethernet II, Src: MicroStarINT_f4:40:30 (4c:cc:6a:f4:40:30), Dst: JinanUSRIOTT_af:87:38 (d4:ad:20:af:87:38)
Internet Protocol Version 4, Src: 192.168.69.218, Dst: 192.168.69.230
Transmission Control Protocol, Src Port: 59566, Dst Port: 8235, Seq: 89, Ack: 2, Len: 8
Data (8 bytes)

0000  e3 03 00 00 00 01 93 88                           ........
    Data: e303000000019388
    [Length: 8]

No.     Time           Source                Destination           Protocol Length Info
    512 27.337135      192.168.69.230        192.168.69.218        TCP      60     8235 → 59566 [ACK] Seq=2 Ack=97 Win=2736 Len=0

Frame 512: 60 bytes on wire (480 bits), 60 bytes captured (480 bits) on interface \Device\NPF_{150B9C73-9A6A-45E3-9512-836F6787EDE2}, id 0
Ethernet II, Src: JinanUSRIOTT_af:87:38 (d4:ad:20:af:87:38), Dst: MicroStarINT_f4:40:30 (4c:cc:6a:f4:40:30)
Internet Protocol Version 4, Src: 192.168.69.230, Dst: 192.168.69.218
Transmission Control Protocol, Src Port: 8235, Dst Port: 59566, Seq: 2, Ack: 97, Len: 0

No.     Time           Source                Destination           Protocol Length Info
    579 29.532880      192.168.69.218        192.168.69.230        TCP      62     59566 → 8235 [PSH, ACK] Seq=97 Ack=2 Win=64090 Len=8

Frame 579: 62 bytes on wire (496 bits), 62 bytes captured (496 bits) on interface \Device\NPF_{150B9C73-9A6A-45E3-9512-836F6787EDE2}, id 0
Ethernet II, Src: MicroStarINT_f4:40:30 (4c:cc:6a:f4:40:30), Dst: JinanUSRIOTT_af:87:38 (d4:ad:20:af:87:38)
Internet Protocol Version 4, Src: 192.168.69.218, Dst: 192.168.69.230
Transmission Control Protocol, Src Port: 59566, Dst Port: 8235, Seq: 97, Ack: 2, Len: 8
Data (8 bytes)

0000  e4 03 00 00 00 01 92 3f                           .......?
    Data: e40300000001923f
    [Length: 8]

No.     Time           Source                Destination           Protocol Length Info
    580 29.533934      192.168.69.230        192.168.69.218        TCP      60     8235 → 59566 [ACK] Seq=2 Ack=105 Win=2728 Len=0

Frame 580: 60 bytes on wire (480 bits), 60 bytes captured (480 bits) on interface \Device\NPF_{150B9C73-9A6A-45E3-9512-836F6787EDE2}, id 0
Ethernet II, Src: JinanUSRIOTT_af:87:38 (d4:ad:20:af:87:38), Dst: MicroStarINT_f4:40:30 (4c:cc:6a:f4:40:30)
Internet Protocol Version 4, Src: 192.168.69.230, Dst: 192.168.69.218
Transmission Control Protocol, Src Port: 8235, Dst Port: 59566, Seq: 2, Ack: 105, Len: 0

No.     Time           Source                Destination           Protocol Length Info
    619 31.744109      192.168.69.218        192.168.69.230        TCP      62     59566 → 8235 [PSH, ACK] Seq=105 Ack=2 Win=64090 Len=8

Frame 619: 62 bytes on wire (496 bits), 62 bytes captured (496 bits) on interface \Device\NPF_{150B9C73-9A6A-45E3-9512-836F6787EDE2}, id 0
Ethernet II, Src: MicroStarINT_f4:40:30 (4c:cc:6a:f4:40:30), Dst: JinanUSRIOTT_af:87:38 (d4:ad:20:af:87:38)
Internet Protocol Version 4, Src: 192.168.69.218, Dst: 192.168.69.230
Transmission Control Protocol, Src Port: 59566, Dst Port: 8235, Seq: 105, Ack: 2, Len: 8
Data (8 bytes)

0000  e5 03 00 00 00 01 93 ee                           ........
    Data: e5030000000193ee
    [Length: 8]

No.     Time           Source                Destination           Protocol Length Info
    620 31.744725      192.168.69.230        192.168.69.218        TCP      60     8235 → 59566 [ACK] Seq=2 Ack=113 Win=2720 Len=0

Frame 620: 60 bytes on wire (480 bits), 60 bytes captured (480 bits) on interface \Device\NPF_{150B9C73-9A6A-45E3-9512-836F6787EDE2}, id 0
Ethernet II, Src: JinanUSRIOTT_af:87:38 (d4:ad:20:af:87:38), Dst: MicroStarINT_f4:40:30 (4c:cc:6a:f4:40:30)
Internet Protocol Version 4, Src: 192.168.69.230, Dst: 192.168.69.218
Transmission Control Protocol, Src Port: 8235, Dst Port: 59566, Seq: 2, Ack: 113, Len: 0

No.     Time           Source                Destination           Protocol Length Info
    745 33.918706      192.168.69.218        192.168.69.230        TCP      62     59566 → 8235 [PSH, ACK] Seq=113 Ack=2 Win=64090 Len=8

Frame 745: 62 bytes on wire (496 bits), 62 bytes captured (496 bits) on interface \Device\NPF_{150B9C73-9A6A-45E3-9512-836F6787EDE2}, id 0
Ethernet II, Src: MicroStarINT_f4:40:30 (4c:cc:6a:f4:40:30), Dst: JinanUSRIOTT_af:87:38 (d4:ad:20:af:87:38)
Internet Protocol Version 4, Src: 192.168.69.218, Dst: 192.168.69.230
Transmission Control Protocol, Src Port: 59566, Dst Port: 8235, Seq: 113, Ack: 2, Len: 8
Data (8 bytes)

0000  e6 03 00 00 00 01 93 dd                           ........
    Data: e6030000000193dd
    [Length: 8]

No.     Time           Source                Destination           Protocol Length Info
    746 33.919532      192.168.69.230        192.168.69.218        TCP      60     8235 → 59566 [ACK] Seq=2 Ack=121 Win=2712 Len=0

Frame 746: 60 bytes on wire (480 bits), 60 bytes captured (480 bits) on interface \Device\NPF_{150B9C73-9A6A-45E3-9512-836F6787EDE2}, id 0
Ethernet II, Src: JinanUSRIOTT_af:87:38 (d4:ad:20:af:87:38), Dst: MicroStarINT_f4:40:30 (4c:cc:6a:f4:40:30)
Internet Protocol Version 4, Src: 192.168.69.230, Dst: 192.168.69.218
Transmission Control Protocol, Src Port: 8235, Dst Port: 59566, Seq: 2, Ack: 121, Len: 0

No.     Time           Source                Destination           Protocol Length Info
    779 36.112644      192.168.69.218        192.168.69.230        TCP      62     59566 → 8235 [PSH, ACK] Seq=121 Ack=2 Win=64090 Len=8

Frame 779: 62 bytes on wire (496 bits), 62 bytes captured (496 bits) on interface \Device\NPF_{150B9C73-9A6A-45E3-9512-836F6787EDE2}, id 0
Ethernet II, Src: MicroStarINT_f4:40:30 (4c:cc:6a:f4:40:30), Dst: JinanUSRIOTT_af:87:38 (d4:ad:20:af:87:38)
Internet Protocol Version 4, Src: 192.168.69.218, Dst: 192.168.69.230
Transmission Control Protocol, Src Port: 59566, Dst Port: 8235, Seq: 121, Ack: 2, Len: 8
Data (8 bytes)

0000  e7 03 00 00 00 01 92 0c                           ........
    Data: e70300000001920c
    [Length: 8]

No.     Time           Source                Destination           Protocol Length Info
    780 36.113323      192.168.69.230        192.168.69.218        TCP      60     8235 → 59566 [ACK] Seq=2 Ack=129 Win=2704 Len=0

Frame 780: 60 bytes on wire (480 bits), 60 bytes captured (480 bits) on interface \Device\NPF_{150B9C73-9A6A-45E3-9512-836F6787EDE2}, id 0
Ethernet II, Src: JinanUSRIOTT_af:87:38 (d4:ad:20:af:87:38), Dst: MicroStarINT_f4:40:30 (4c:cc:6a:f4:40:30)
Internet Protocol Version 4, Src: 192.168.69.230, Dst: 192.168.69.218
Transmission Control Protocol, Src Port: 8235, Dst Port: 59566, Seq: 2, Ack: 129, Len: 0

No.     Time           Source                Destination           Protocol Length Info
    850 38.303121      192.168.69.218        192.168.69.230        TCP      62     59566 → 8235 [PSH, ACK] Seq=129 Ack=2 Win=64090 Len=8

Frame 850: 62 bytes on wire (496 bits), 62 bytes captured (496 bits) on interface \Device\NPF_{150B9C73-9A6A-45E3-9512-836F6787EDE2}, id 0
Ethernet II, Src: MicroStarINT_f4:40:30 (4c:cc:6a:f4:40:30), Dst: JinanUSRIOTT_af:87:38 (d4:ad:20:af:87:38)
Internet Protocol Version 4, Src: 192.168.69.218, Dst: 192.168.69.230
Transmission Control Protocol, Src Port: 59566, Dst Port: 8235, Seq: 129, Ack: 2, Len: 8
Data (8 bytes)

0000  d6 03 00 00 00 01 96 2d                           .......-
    Data: d60300000001962d
    [Length: 8]

No.     Time           Source                Destination           Protocol Length Info
    851 38.304111      192.168.69.230        192.168.69.218        TCP      60     8235 → 59566 [ACK] Seq=2 Ack=137 Win=2696 Len=0

Frame 851: 60 bytes on wire (480 bits), 60 bytes captured (480 bits) on interface \Device\NPF_{150B9C73-9A6A-45E3-9512-836F6787EDE2}, id 0
Ethernet II, Src: JinanUSRIOTT_af:87:38 (d4:ad:20:af:87:38), Dst: MicroStarINT_f4:40:30 (4c:cc:6a:f4:40:30)
Internet Protocol Version 4, Src: 192.168.69.230, Dst: 192.168.69.218
Transmission Control Protocol, Src Port: 8235, Dst Port: 59566, Seq: 2, Ack: 137, Len: 0

No.     Time           Source                Destination           Protocol Length Info
    898 40.502932      192.168.69.218        192.168.69.230        TCP      62     59566 → 8235 [PSH, ACK] Seq=137 Ack=2 Win=64090 Len=8

Frame 898: 62 bytes on wire (496 bits), 62 bytes captured (496 bits) on interface \Device\NPF_{150B9C73-9A6A-45E3-9512-836F6787EDE2}, id 0
Ethernet II, Src: MicroStarINT_f4:40:30 (4c:cc:6a:f4:40:30), Dst: JinanUSRIOTT_af:87:38 (d4:ad:20:af:87:38)
Internet Protocol Version 4, Src: 192.168.69.218, Dst: 192.168.69.230
Transmission Control Protocol, Src Port: 59566, Dst Port: 8235, Seq: 137, Ack: 2, Len: 8
Data (8 bytes)

0000  d7 03 00 00 00 01 97 fc                           ........
    Data: d7030000000197fc
    [Length: 8]

No.     Time           Source                Destination           Protocol Length Info
    899 40.503931      192.168.69.230        192.168.69.218        TCP      60     8235 → 59566 [ACK] Seq=2 Ack=145 Win=2688 Len=0

Frame 899: 60 bytes on wire (480 bits), 60 bytes captured (480 bits) on interface \Device\NPF_{150B9C73-9A6A-45E3-9512-836F6787EDE2}, id 0
Ethernet II, Src: JinanUSRIOTT_af:87:38 (d4:ad:20:af:87:38), Dst: MicroStarINT_f4:40:30 (4c:cc:6a:f4:40:30)
Internet Protocol Version 4, Src: 192.168.69.230, Dst: 192.168.69.218
Transmission Control Protocol, Src Port: 8235, Dst Port: 59566, Seq: 2, Ack: 145, Len: 0

No.     Time           Source                Destination           Protocol Length Info
    932 42.695070      192.168.69.218        192.168.69.230        TCP      62     59566 → 8235 [PSH, ACK] Seq=145 Ack=2 Win=64090 Len=8

Frame 932: 62 bytes on wire (496 bits), 62 bytes captured (496 bits) on interface \Device\NPF_{150B9C73-9A6A-45E3-9512-836F6787EDE2}, id 0
Ethernet II, Src: MicroStarINT_f4:40:30 (4c:cc:6a:f4:40:30), Dst: JinanUSRIOTT_af:87:38 (d4:ad:20:af:87:38)
Internet Protocol Version 4, Src: 192.168.69.218, Dst: 192.168.69.230
Transmission Control Protocol, Src Port: 59566, Dst Port: 8235, Seq: 145, Ack: 2, Len: 8
Data (8 bytes)

0000  d8 03 00 00 00 01 97 03                           ........
    Data: d803000000019703
    [Length: 8]

No.     Time           Source                Destination           Protocol Length Info
    933 42.695700      192.168.69.230        192.168.69.218        TCP      60     8235 → 59566 [ACK] Seq=2 Ack=153 Win=2680 Len=0

Frame 933: 60 bytes on wire (480 bits), 60 bytes captured (480 bits) on interface \Device\NPF_{150B9C73-9A6A-45E3-9512-836F6787EDE2}, id 0
Ethernet II, Src: JinanUSRIOTT_af:87:38 (d4:ad:20:af:87:38), Dst: MicroStarINT_f4:40:30 (4c:cc:6a:f4:40:30)
Internet Protocol Version 4, Src: 192.168.69.230, Dst: 192.168.69.218
Transmission Control Protocol, Src Port: 8235, Dst Port: 59566, Seq: 2, Ack: 153, Len: 0

No.     Time           Source                Destination           Protocol Length Info
    986 44.888582      192.168.69.218        192.168.69.230        TCP      62     59566 → 8235 [PSH, ACK] Seq=153 Ack=2 Win=64090 Len=8

Frame 986: 62 bytes on wire (496 bits), 62 bytes captured (496 bits) on interface \Device\NPF_{150B9C73-9A6A-45E3-9512-836F6787EDE2}, id 0
Ethernet II, Src: MicroStarINT_f4:40:30 (4c:cc:6a:f4:40:30), Dst: JinanUSRIOTT_af:87:38 (d4:ad:20:af:87:38)
Internet Protocol Version 4, Src: 192.168.69.218, Dst: 192.168.69.230
Transmission Control Protocol, Src Port: 59566, Dst Port: 8235, Seq: 153, Ack: 2, Len: 8
Data (8 bytes)

0000  d9 03 00 00 00 01 96 d2                           ........
    Data: d9030000000196d2
    [Length: 8]

No.     Time           Source                Destination           Protocol Length Info
    987 44.889515      192.168.69.230        192.168.69.218        TCP      60     8235 → 59566 [ACK] Seq=2 Ack=161 Win=2672 Len=0

Frame 987: 60 bytes on wire (480 bits), 60 bytes captured (480 bits) on interface \Device\NPF_{150B9C73-9A6A-45E3-9512-836F6787EDE2}, id 0
Ethernet II, Src: JinanUSRIOTT_af:87:38 (d4:ad:20:af:87:38), Dst: MicroStarINT_f4:40:30 (4c:cc:6a:f4:40:30)
Internet Protocol Version 4, Src: 192.168.69.230, Dst: 192.168.69.218
Transmission Control Protocol, Src Port: 8235, Dst Port: 59566, Seq: 2, Ack: 161, Len: 0

No.     Time           Source                Destination           Protocol Length Info
    988 44.917125      192.168.69.230        192.168.69.218        TCP      61     8235 → 59566 [PSH, ACK] Seq=2 Ack=161 Win=2672 Len=7

Frame 988: 61 bytes on wire (488 bits), 61 bytes captured (488 bits) on interface \Device\NPF_{150B9C73-9A6A-45E3-9512-836F6787EDE2}, id 0
Ethernet II, Src: JinanUSRIOTT_af:87:38 (d4:ad:20:af:87:38), Dst: MicroStarINT_f4:40:30 (4c:cc:6a:f4:40:30)
Internet Protocol Version 4, Src: 192.168.69.230, Dst: 192.168.69.218
Transmission Control Protocol, Src Port: 8235, Dst Port: 59566, Seq: 2, Ack: 161, Len: 7
Data (7 bytes)

0000  d9 03 02 13 3e 14 b7                              ....>..
    Data: d90302133e14b7
    [Length: 7]

No.     Time           Source                Destination           Protocol Length Info
    989 44.966209      192.168.69.218        192.168.69.230        TCP      54     59566 → 8235 [ACK] Seq=161 Ack=9 Win=64083 Len=0

Frame 989: 54 bytes on wire (432 bits), 54 bytes captured (432 bits) on interface \Device\NPF_{150B9C73-9A6A-45E3-9512-836F6787EDE2}, id 0
Ethernet II, Src: MicroStarINT_f4:40:30 (4c:cc:6a:f4:40:30), Dst: JinanUSRIOTT_af:87:38 (d4:ad:20:af:87:38)
Internet Protocol Version 4, Src: 192.168.69.218, Dst: 192.168.69.230
Transmission Control Protocol, Src Port: 59566, Dst Port: 8235, Seq: 161, Ack: 9, Len: 0

No.     Time           Source                Destination           Protocol Length Info
    991 45.012507      192.168.69.218        192.168.69.230        TCP      62     59566 → 8235 [PSH, ACK] Seq=161 Ack=9 Win=64083 Len=8

Frame 991: 62 bytes on wire (496 bits), 62 bytes captured (496 bits) on interface \Device\NPF_{150B9C73-9A6A-45E3-9512-836F6787EDE2}, id 0
Ethernet II, Src: MicroStarINT_f4:40:30 (4c:cc:6a:f4:40:30), Dst: JinanUSRIOTT_af:87:38 (d4:ad:20:af:87:38)
Internet Protocol Version 4, Src: 192.168.69.218, Dst: 192.168.69.230
Transmission Control Protocol, Src Port: 59566, Dst Port: 8235, Seq: 161, Ack: 9, Len: 8
Data (8 bytes)

0000  da 03 00 00 00 01 96 e1                           ........
    Data: da030000000196e1
    [Length: 8]

No.     Time           Source                Destination           Protocol Length Info
    992 45.013518      192.168.69.230        192.168.69.218        TCP      60     8235 → 59566 [ACK] Seq=9 Ack=169 Win=2664 Len=0

Frame 992: 60 bytes on wire (480 bits), 60 bytes captured (480 bits) on interface \Device\NPF_{150B9C73-9A6A-45E3-9512-836F6787EDE2}, id 0
Ethernet II, Src: JinanUSRIOTT_af:87:38 (d4:ad:20:af:87:38), Dst: MicroStarINT_f4:40:30 (4c:cc:6a:f4:40:30)
Internet Protocol Version 4, Src: 192.168.69.230, Dst: 192.168.69.218
Transmission Control Protocol, Src Port: 8235, Dst Port: 59566, Seq: 9, Ack: 169, Len: 0

No.     Time           Source                Destination           Protocol Length Info
   1026 47.211937      192.168.69.218        192.168.69.230        TCP      62     59566 → 8235 [PSH, ACK] Seq=169 Ack=9 Win=64083 Len=8

Frame 1026: 62 bytes on wire (496 bits), 62 bytes captured (496 bits) on interface \Device\NPF_{150B9C73-9A6A-45E3-9512-836F6787EDE2}, id 0
Ethernet II, Src: MicroStarINT_f4:40:30 (4c:cc:6a:f4:40:30), Dst: JinanUSRIOTT_af:87:38 (d4:ad:20:af:87:38)
Internet Protocol Version 4, Src: 192.168.69.218, Dst: 192.168.69.230
Transmission Control Protocol, Src Port: 59566, Dst Port: 8235, Seq: 169, Ack: 9, Len: 8
Data (8 bytes)

0000  db 03 00 00 00 01 97 30                           .......0
    Data: db03000000019730
    [Length: 8]

No.     Time           Source                Destination           Protocol Length Info
   1027 47.212296      192.168.69.230        192.168.69.218        TCP      60     8235 → 59566 [ACK] Seq=9 Ack=177 Win=2656 Len=0

Frame 1027: 60 bytes on wire (480 bits), 60 bytes captured (480 bits) on interface \Device\NPF_{150B9C73-9A6A-45E3-9512-836F6787EDE2}, id 0
Ethernet II, Src: JinanUSRIOTT_af:87:38 (d4:ad:20:af:87:38), Dst: MicroStarINT_f4:40:30 (4c:cc:6a:f4:40:30)
Internet Protocol Version 4, Src: 192.168.69.230, Dst: 192.168.69.218
Transmission Control Protocol, Src Port: 8235, Dst Port: 59566, Seq: 9, Ack: 177, Len: 0

No.     Time           Source                Destination           Protocol Length Info
   1081 49.395174      192.168.69.218        192.168.69.230        TCP      62     59566 → 8235 [PSH, ACK] Seq=177 Ack=9 Win=64083 Len=8

Frame 1081: 62 bytes on wire (496 bits), 62 bytes captured (496 bits) on interface \Device\NPF_{150B9C73-9A6A-45E3-9512-836F6787EDE2}, id 0
Ethernet II, Src: MicroStarINT_f4:40:30 (4c:cc:6a:f4:40:30), Dst: JinanUSRIOTT_af:87:38 (d4:ad:20:af:87:38)
Internet Protocol Version 4, Src: 192.168.69.218, Dst: 192.168.69.230
Transmission Control Protocol, Src Port: 59566, Dst Port: 8235, Seq: 177, Ack: 9, Len: 8
Data (8 bytes)

0000  dc 03 00 00 00 01 96 87                           ........
    Data: dc03000000019687
    [Length: 8]

No.     Time           Source                Destination           Protocol Length Info
   1082 49.396094      192.168.69.230        192.168.69.218        TCP      60     8235 → 59566 [ACK] Seq=9 Ack=185 Win=2648 Len=0

Frame 1082: 60 bytes on wire (480 bits), 60 bytes captured (480 bits) on interface \Device\NPF_{150B9C73-9A6A-45E3-9512-836F6787EDE2}, id 0
Ethernet II, Src: JinanUSRIOTT_af:87:38 (d4:ad:20:af:87:38), Dst: MicroStarINT_f4:40:30 (4c:cc:6a:f4:40:30)
Internet Protocol Version 4, Src: 192.168.69.230, Dst: 192.168.69.218
Transmission Control Protocol, Src Port: 8235, Dst Port: 59566, Seq: 9, Ack: 185, Len: 0

No.     Time           Source                Destination           Protocol Length Info
   1109 51.581926      192.168.69.218        192.168.69.230        TCP      62     59566 → 8235 [PSH, ACK] Seq=185 Ack=9 Win=64083 Len=8

Frame 1109: 62 bytes on wire (496 bits), 62 bytes captured (496 bits) on interface \Device\NPF_{150B9C73-9A6A-45E3-9512-836F6787EDE2}, id 0
Ethernet II, Src: MicroStarINT_f4:40:30 (4c:cc:6a:f4:40:30), Dst: JinanUSRIOTT_af:87:38 (d4:ad:20:af:87:38)
Internet Protocol Version 4, Src: 192.168.69.218, Dst: 192.168.69.230
Transmission Control Protocol, Src Port: 59566, Dst Port: 8235, Seq: 185, Ack: 9, Len: 8
Data (8 bytes)

0000  dd 03 00 00 00 01 97 56                           .......V
    Data: dd03000000019756
    [Length: 8]

No.     Time           Source                Destination           Protocol Length Info
   1110 51.582897      192.168.69.230        192.168.69.218        TCP      60     8235 → 59566 [ACK] Seq=9 Ack=193 Win=2640 Len=0

Frame 1110: 60 bytes on wire (480 bits), 60 bytes captured (480 bits) on interface \Device\NPF_{150B9C73-9A6A-45E3-9512-836F6787EDE2}, id 0
Ethernet II, Src: JinanUSRIOTT_af:87:38 (d4:ad:20:af:87:38), Dst: MicroStarINT_f4:40:30 (4c:cc:6a:f4:40:30)
Internet Protocol Version 4, Src: 192.168.69.230, Dst: 192.168.69.218
Transmission Control Protocol, Src Port: 8235, Dst Port: 59566, Seq: 9, Ack: 193, Len: 0

No.     Time           Source                Destination           Protocol Length Info
   1156 53.763536      192.168.69.218        192.168.69.230        TCP      62     59566 → 8235 [PSH, ACK] Seq=193 Ack=9 Win=64083 Len=8

Frame 1156: 62 bytes on wire (496 bits), 62 bytes captured (496 bits) on interface \Device\NPF_{150B9C73-9A6A-45E3-9512-836F6787EDE2}, id 0
Ethernet II, Src: MicroStarINT_f4:40:30 (4c:cc:6a:f4:40:30), Dst: JinanUSRIOTT_af:87:38 (d4:ad:20:af:87:38)
Internet Protocol Version 4, Src: 192.168.69.218, Dst: 192.168.69.230
Transmission Control Protocol, Src Port: 59566, Dst Port: 8235, Seq: 193, Ack: 9, Len: 8
Data (8 bytes)

0000  e0 03 00 00 00 01 93 bb                           ........
    Data: e0030000000193bb
    [Length: 8]

No.     Time           Source                Destination           Protocol Length Info
   1157 53.764709      192.168.69.230        192.168.69.218        TCP      60     8235 → 59566 [ACK] Seq=9 Ack=201 Win=2632 Len=0

Frame 1157: 60 bytes on wire (480 bits), 60 bytes captured (480 bits) on interface \Device\NPF_{150B9C73-9A6A-45E3-9512-836F6787EDE2}, id 0
Ethernet II, Src: JinanUSRIOTT_af:87:38 (d4:ad:20:af:87:38), Dst: MicroStarINT_f4:40:30 (4c:cc:6a:f4:40:30)
Internet Protocol Version 4, Src: 192.168.69.230, Dst: 192.168.69.218
Transmission Control Protocol, Src Port: 8235, Dst Port: 59566, Seq: 9, Ack: 201, Len: 0

No.     Time           Source                Destination           Protocol Length Info
   1185 55.948473      192.168.69.218        192.168.69.230        TCP      62     59566 → 8235 [PSH, ACK] Seq=201 Ack=9 Win=64083 Len=8

Frame 1185: 62 bytes on wire (496 bits), 62 bytes captured (496 bits) on interface \Device\NPF_{150B9C73-9A6A-45E3-9512-836F6787EDE2}, id 0
Ethernet II, Src: MicroStarINT_f4:40:30 (4c:cc:6a:f4:40:30), Dst: JinanUSRIOTT_af:87:38 (d4:ad:20:af:87:38)
Internet Protocol Version 4, Src: 192.168.69.218, Dst: 192.168.69.230
Transmission Control Protocol, Src Port: 59566, Dst Port: 8235, Seq: 201, Ack: 9, Len: 8
Data (8 bytes)

0000  e1 03 00 00 00 01 92 6a                           .......j
    Data: e10300000001926a
    [Length: 8]

No.     Time           Source                Destination           Protocol Length Info
   1186 55.949510      192.168.69.230        192.168.69.218        TCP      60     8235 → 59566 [ACK] Seq=9 Ack=209 Win=2624 Len=0

Frame 1186: 60 bytes on wire (480 bits), 60 bytes captured (480 bits) on interface \Device\NPF_{150B9C73-9A6A-45E3-9512-836F6787EDE2}, id 0
Ethernet II, Src: JinanUSRIOTT_af:87:38 (d4:ad:20:af:87:38), Dst: MicroStarINT_f4:40:30 (4c:cc:6a:f4:40:30)
Internet Protocol Version 4, Src: 192.168.69.230, Dst: 192.168.69.218
Transmission Control Protocol, Src Port: 8235, Dst Port: 59566, Seq: 9, Ack: 209, Len: 0

No.     Time           Source                Destination           Protocol Length Info
   1230 58.132466      192.168.69.218        192.168.69.230        TCP      62     59566 → 8235 [PSH, ACK] Seq=209 Ack=9 Win=64083 Len=8

Frame 1230: 62 bytes on wire (496 bits), 62 bytes captured (496 bits) on interface \Device\NPF_{150B9C73-9A6A-45E3-9512-836F6787EDE2}, id 0
Ethernet II, Src: MicroStarINT_f4:40:30 (4c:cc:6a:f4:40:30), Dst: JinanUSRIOTT_af:87:38 (d4:ad:20:af:87:38)
Internet Protocol Version 4, Src: 192.168.69.218, Dst: 192.168.69.230
Transmission Control Protocol, Src Port: 59566, Dst Port: 8235, Seq: 209, Ack: 9, Len: 8
Data (8 bytes)

0000  e2 03 00 00 00 01 92 59                           .......Y
    Data: e203000000019259
    [Length: 8]

No.     Time           Source                Destination           Protocol Length Info
   1231 58.133281      192.168.69.230        192.168.69.218        TCP      60     8235 → 59566 [ACK] Seq=9 Ack=217 Win=2616 Len=0

Frame 1231: 60 bytes on wire (480 bits), 60 bytes captured (480 bits) on interface \Device\NPF_{150B9C73-9A6A-45E3-9512-836F6787EDE2}, id 0
Ethernet II, Src: JinanUSRIOTT_af:87:38 (d4:ad:20:af:87:38), Dst: MicroStarINT_f4:40:30 (4c:cc:6a:f4:40:30)
Internet Protocol Version 4, Src: 192.168.69.230, Dst: 192.168.69.218
